"Which statement is least accurate about the definition of ""Done""?",multiple-choice,It's created by the Product Owner,"There can be more than one definition of ""Done"" when multiple teams are working on the same product.",It may be defined by the development organization,,,,1,"The definition of ""Done"" can be prepared in the development organization and used in all projects as a minimum. If additional content is required for the definition or it's not prepared in the organization level, the Development Team would be responsible for preparing it. The definition of ""Done"" can evolve during the project as more is learned. It's also dependent on the project and its environment. Multiple teams can have different definitions of ""Done"", as long as they are compatible and capable of creating an integrated Increment at the end of the Sprint.",Artifact Transparency
Which two statements are right about technical debt?,multi-select,"When measured properly, the Product Owner can estimate when the product is ready for release",The Development Team should not start working on a new item unless they remove all existing technical debt,"It creates uncertainty, because when more code is added, more problems will occur and the development slows down",It creates false assumptions about the current state of the system; e.g. it might not be really releasable.,,,"3,4","Technical debt is the consequence of poor system design and architecture which can happen when they are done gradually in an adaptive environment. The Development Team should be careful with it and repay it with continuous refactoring. Refactoring is improving the code without changing the external behavior. If the technical debt keeps increasing because the team doesn't refactor, development will become harder day after day and it will slow down the progress on one hand and create problems for releases on the other hand.",Scrum Artifacts
Hardening Sprints are helpful for defect management and integration.,multiple-choice,TRUE,FALSE,,,,,2,"There's no hardening Sprints in Scrum. All Sprints are the same and create Increments. ""Hardening"" is done during all Sprints.",Scrum Events
Developers sign up to own backlog items at the Sprint Planning.,multiple-choice,TRUE,FALSE,,,,,2,"The ownership of the items and tasks are shared. The items are not even ""assigned"" to developers because they require multiple expertise. Only the tasks are assigned and even then, their ownership is shared.",The Scrum Team
Which of the following is less likely to be used by a Scrum Team?,multiple-choice,"Large screen, planning poker cards","Wiki, online forum","WBS, Gantt Chart","Digital camera, task board",,,3,WBS and Gantt Charts are used in traditional projects because they are focused on an upfront understanding of the scope of the project. The scope of Agile projects evolve during the project.,The Scrum Team
Who can change the Sprint Backlog during the Sprint?,multiple-choice,The Development Team,No one,The Development Team and the Product Owner together,The Product Owner,,,1,"The Product Backlog items in the Sprint Backlog do not change but another element in the Sprint Backlog is the tasks and they are always changing. This is the responsibility of the Development Team to make changes in the Sprint Backlog tasks; while they may also ""consult"" the Product Owner for this.",Scrum Artifacts
Sprint Review is a formal meeting that requires sign-off by the stakeholders,multiple-choice,TRUE,FALSE,,,,,2,Sprint Review is used for informal collaboration and creating feedback. It's not a formal meeting with signed approvals and handovers.,Scrum Events
A baselined Product Backlog is called:,multiple-choice,Release plan,Product Backlog is not baselined in Scrum,Sprint Backlog,Product vision,"""Ready"" Product Backlog",,2,"""Baselining"" is a term used in traditional environments for referring to a finalized upfront plan that would be followed in the future and used for evaluating the actual performance. There's no upfront planning and no baselines in Scrum.",Scrum Artifacts
The Sprint Backlog emerges during the Sprint.,multiple-choice,TRUE,FALSE,,,,,1,"While the Product Backlog items selected for the Sprint Backlog stay the same, the tasks created by decomposing them always change and emerge during the Sprint.",Scrum Artifacts
"The Product Owner ""owns"" the Product Backlog.",multiple-choice,TRUE,FALSE,,,,,1,"The Product Owner is the sole responsible person and they even ""own"" the Product Backlog. Note: remember that the Sprint Backlog is owned by the Development Team. This is not in contrast to the fact that the Product Backlog items are estimated by the developers; they provide this information to the Product Owner to be included in the Product Backlog. There are multiple implications by saying that the Product Owner ""owns"" the Product Backlog or is the sole responsible person, including: (a) Only they can add items to the backlog or decompose them into smaller items; while this is done by input from the customers and developers, and even the Product Owner can delegate this responsibility to the developers. (b) Only they can decide on the order of the items on the Product Backlog, while this is usually based on the input from customers and developers.",The Scrum Team
The Product Owner and the Scrum Master cannot tell the Development Team how to build the product.,multiple-choice,TRUE,FALSE,,,,,1,The Development Team is self-organized and finds its own way instead of receiving orders.,The Scrum Team
Which two of the following are true about Scrum? (Choose 2 answers),multi-select,Scrum is a methodology for managing complex projects.,Scrum is like traditional processes but with Sprints and related artifacts.,Scrum is a framework for developing and maintaining complex products.,Scrum is based on empirical process control theory,,,"3,4","Scrum is a framework, not a methodology or body of knowledge. Scrum is empirical, rather than theoretical. Scrum is more about project delivery rather than project management. Scrum is adaptive, rather than predictive (it's more than just using Sprints and related artifacts). Scrum should be used in its entirety (we do not tailor it).",Scrum Theory
Only the Scrum Team is allowed to attend the Sprint Planning.,multiple-choice,TRUE,FALSE,,,,,2,"Everyone is free to ""attend"" the events as long as their participation is beneficial.",Scrum Events
A four-hour Sprint Planning is the timebox for Sprints that are ... long.,multiple-choice,Four weeks,Three weeks,One week,Two weeks,,,4,Sprint Planning is 8 hours for a one-month Sprint and usually shorter proportionally for short Sprints.,Scrum Events
Which of the following does NOT happen in the first Sprint? (Choose 2 answers),multi-select,Creating a complete Product Backlog,Creating a piece of working software,Creating a releasable Increment,Designing the complete architecture,,,"1,4","The Product Backlog is a dynamic concept that is never complete; especially, at the beginning of the project. Trying to prepare a complete Product Backlog at the beginning of the project is a form of upfront planning that doesn't suit Agile environments. The same goes for the architecture; it's not designed upfront, because we don't know exactly what we're going to develop.

All Sprints have the same purpose of bringing value to the customer by creating a potentially releasable Increment.",Scrum Events
Which of the following is a responsibility of the project manager in Scrum?,multiple-choice,There's no project manager in Scrum,Making high-level decisions,Authorizing the Sprints,Planning releases,Preparing the project plan and Gantt Charts,,1,"There are only three roles in Scrum and it's not allowed to add other roles or titles: Product Owner, Scrum Master and Development Team",The Scrum Team
Using timeboxed Sprints help limit work-in-progress.,multiple-choice,TRUE,FALSE,,,,,1,"When working inside timeboxes, it's better to limit work-in-progress and get items done before going to the next ones; otherwise, chances would be high that the team ends up with many in-progress items and not enough ""Done"" items at the end of the Sprint.
Limiting work-in-progress is a lean concept that avoids waste.",Scrum Events
Who makes sure that all developers are doing their tasks during the Sprint?,multiple-choice,The Scrum Master,The project manager,The Development Team,The Product Owner,,,3,"The developers take responsibility for doing the tasks (assignment) themselves and the Development Team ensures that all tasks are done properly. Remember that they are self-organized.

When items are ""Done"", the Product Owner checks them but this is focused on the item rather than individuals; all developers are accountable for their outputs.",The Scrum Team
Which is NOT a Development Team responsibility?,multiple-choice,Volunteering for tasks,Creating tasks,Measuring their own performance,Breaking down the items in the Product Backlog into smaller items,,,4,"This is the responsibility of the Product Owner to break down the large Product Backlog items into smaller ones. The Development Team usually ""helps"" in this but it doesn't make them responsible.",The Scrum Team
Which two statements are correct during the Sprint?,multi-select,Some Sprint Backlog items would be replaced with items from the Product Backlog if the priorities change,The scope may be clarified as more is learned,The scope may be re-negotiated as more is learned,Some Sprint Backlog items would be moved back to the Product Backlog to be completed in future Sprints,,,"2,3","During the Sprint, the Product Backlog items in the Sprint Backlog would not be added or removed but as more is learned, the scope may be clarified and re-negotiated between the Product Owner and Development Team. This is mainly focused on the interpretation of the Product Backlog items and the tasks created by decomposing them.",Scrum Events
Which of the following are optional in Scrum? (choose 2 answers),multi-select,Velocity,Having potentially releasable Increments,Release plan,Measuring Sprint performance,Product Backlog,,"1,3","Having a release plan is usually required but it's not part of the framework and is not mandatory.
Velocity calculation is also helpful and recommended but is not part of the framework.
The rest are Scrum artifacts. All Scrum roles, events and artifacts are mandatory.",Scrum Theory
Which of the following is a right action from the Scrum Master in response to a Product Owner who has problems managing the Product Backlog?,multiple-choice,Ask the Development Team to help the Product Owner understand the dependencies among items to be used in ordering them,Help the Product Owner order the items,Extend the Sprint so that the Product Owner has more time ordering items,Ask the customer to order the items instead of the Product Owner,,,2,"The Scrum Master is supposed to know the tools and techniques and to help everyone in that regard. However, it's only about helping, training, coaching and consulting rather than taking over.",The Scrum Team
The Product Owner ensures enough items are selected from the Product Backlog in the Sprint Planning meeting to satisfy the stakeholders.,multiple-choice,TRUE,FALSE,,,,,2,It's only up to the developers to decide how many items they will select from the top of the Product Backlog. The Product Owner only orders the items.,Scrum Events
Which statement is correct when the developers are working in the middle of the Sprint?,multiple-choice,The Sprint Backlog would be frozen,No user acceptance tests will be conducted until the end of the Sprint,The scope may be clarified as more is learned,,,,3,"During the Sprint, the Product Backlog items in the Sprint Backlog would not be added or removed but as more is learned, the scope may be clarified and re-negotiated between the Product Owner and Development Team. This is mainly focused on the interpretation of the Product Backlog items and the tasks created by decomposing them.",The Scrum Team
The Sprint Review is the only time when stakeholder feedback is captured.,multiple-choice,TRUE,FALSE,,,,,2,The Sprint Review is probably the most important opportunity for capturing feedback but adaptation is not limited to that. The Product Owner is constantly in contact with the stakeholders to identify new Product Backlog items or to refine them.,Scrum Events
Who updates work remaining during the Sprint?,multiple-choice,The Development Team,The Scrum Team,The Scrum Master,The Product Owner,,,1,he Product Owner is responsible for measuring the progress of the project and tracking the remaining work in the Product Backlog. The Development Team is responsible for measuring the progress of the Sprint and tracking the remaining work in the Sprint Backlog.,Scrum Artifacts
It's required to use user stories in Scrum.,multiple-choice,TRUE,FALSE,,,,,2,It's a good idea to use user stories for describing the Product Backlog items but it's not required.,Scrum Artifacts