,Question Type (multiple-choice or multi-select),Answer Option 1,Answer Option 2,Answer Option 3,Answer Option 4,Answer Option 5,Answer Option 6,Correct Response,Explanation,Knowledge Area
Who's responsible for Gantt Charts in Scrum?,multiple-choice,No one,The Scrum Master,The Development Team,The project manager,,,1,Gantt Chart is not a Scrum artifact and not compatible with the framework.,The Scrum Team
Which statements are correct about Product Backlog refinement? (Choose 2 answers),multi-select,It should be done right before the Sprint Planning,The Scrum Master should facilitate it,It shouldn't take more than 10% of the Development Team's time,Multiple teams may participate,,,"3,4","If multiple teams are working on the project, they will participate in the refinement as well. Refinement can take any amount of time from the Product Owner but not more than 10% of the capacity of the Development Team.

Refinement is a continuous activity not limited to a certain time during the Sprint. The Scrum Master only facilitates the meetings as requested or required; not by default.",Scrum Events
"The Product Owner has doubts about the quality of the definition of ""Done"". What should s/he do?",multiple-choice,"Adjust the definition of ""Done"" immediately","Adjust the definition of ""Done"" at the end of the Sprint",Ask the company QA department to investigate the issue,Point it out in the next Sprint Retrospective,,,4,"The Development Team is responsible for the definition of ""Done"" rather than the Product Owner. So, if the Product Owner doubts the quality of the definition of ""Done"", he/she can discuss it with the team on the next Sprint Retrospective, so that if they agree, it would be adjusted for the next Sprint.",Scrum Artifacts
How long does the Sprint Planning take in a project with three-week Sprints?,multiple-choice,8 hours,3 hours,6 hours,4 hours,,,3,Sprint Planning is 8 hours for a one-month Sprint and usually shorter proportionally for shorter Sprints.,Scrum Events
Which Scrum artifacts are ordered?,multiple-choice,Only the Product Backlog,None,Both the Product Backlog and Sprint Backlog,Only the Sprint Backlog,,,3,"The Product Backlog is ordered (prioritized) based on the business value.

The items in the Sprint Backlog follow the same order they had in the Product Backlog, therefore, are prioritized.",Scrum Artifacts
"Which of the following describe the definition of ""Done""? (choose 2 answers)",multi-select,Helps increase velocity,Increases transparency,Ensures everything is documented,Helps ensure the Increment is releasable,,,"2,4","Definition of ""Done"" increases transparency because everyone knows what it means by ""Done"". It includes everything required for creating something usable by the end users (potentially releasable).",Artifact Transparency
Pick 4 activities that are the responsibility of the Development Team.,multi-select,Using Story Point estimations.,Provide estimates,Break down epic user stories into smaller ones,Design software,Make technical decisions,Volunteer for tasks,"2,4,5,6",Designing the software is part of the development and should be done by the developers. They are self-organized and make technical decisions and volunteer for tasks (assign them to themselves). Estimation is the responsibility of the developers because they are the people who will develop the item.,The Scrum Team
Which of the following is a valid service from the Scrum Master to the Product Owner?,multiple-choice,Helping the Product Owner find techniques for managing the Product Backlog.,Act as a proxy when the Product Owner is not available to the team.,Helping the Product Owner order the Product Backlog items in order to maximize value.,"Act as the middleman between the Product Owner and the Development Team, as requested or required",,,1,"The following are the Scrum Master services to the Product Owner as described in the Scrum Guide:
-Finding techniques for effective Product Backlog management;
-Helping the Scrum Team understand the need for clear and concise Product Backlog items;
-Understanding product planning in an empirical environment;
-Ensuring the Product Owner knows how to arrange the Product Backlog to maximize value;
-Understanding and practicing agility;
-Facilitating Scrum events as requested or needed.
-These are mainly focused on coaching/training, rather than getting involved and helping someone do something.",The Scrum Team
When does inspection occur?,multiple-choice,When the Product Owner finds necessary,"Frequently, but not so often that gets in the way of work.",All the time,At the Sprint Review,,,2,"All Scrum events are opportunities for inspection and adaptation.

Inspection makes adaptation possible and that's why it's important. However, like anything else in Agile, we just like to have ""enough"" of it.",Scrum Theory
When is it time for integrating the solution?,multiple-choice,Before releasing the Increment,At the end of the Sprint,During the Sprint,At the end of the project,,,3,"Integration is part of the development of each item and a step in a normal definition of ""Done"". Agile projects use continuous integration to make the output potentially releasable.",Scrum Events
Which role is responsible for managing the Development Team?,multiple-choice,Team leader,Development Team,Product Owner,Scrum Master,Scrum Team,,2,The Development Team is self-organized and manages itself instead of receiving orders.,The Scrum Team
The Sprint Backlog makes visible all of the work the ... identifies as necessary to meet the Sprint Goal.,multiple-choice,Development Team,Scrum Team,Product Owner,Scrum Master,,,1,"This is up to the developers to identify how to accomplish the goal. After all, they are the technical people in the project.

The question is about the Sprint Backlog tasks, rather than items.",Scrum Artifacts
Who monitors the remaining work of the Product Backlog?,multiple-choice,The Development Team,The Scrum Master,The Product Owner,The Scrum Team,,,3,"The Product Owner is responsible for measuring the progress of the project and tracking the remaining work in the Product Backlog.

The Development Team is responsible for measuring the progress of the Sprint and tracking the remaining work in the Sprint Backlog.",The Scrum Team
Who can change the Sprint Backlog in the middle of the Sprint?,multiple-choice,Only the Scrum Master,Only the Development Team,Only the Product Owner,The Scrum Team,,,2,he Product Backlog items selected for the Sprint do not change but the Sprint Backlog also contains tasks and tasks evolve through the Sprint. The Development Team owns the Sprint Backlog and only they can change the Sprint Backlog. This is sometimes done based on the input from the Product Owner.,Scrum Artifacts
What type of process control is Scrum?,multiple-choice,Traditional,Adaptive,Empirical,Modern,,,3,Scrum is empirical; based on the real-world experiences.,Scrum Theory
Who assigns tasks to the developers?,multiple-choice,The Product Owner,The Scrum Master,The project manager,Developers themselves,,,4,"The developers take responsibility for doing the tasks themselves and the Development Team ensures that all tasks are done properly. Remember that they are self-organized. When items are ""Done"", the Product Owner checked them but this is focused on the item rather than individuals; all developers are accountable for the team's outputs.",The Scrum Team
How should developers deal with non-functional features?,multiple-choice,Incorporate them into every Increment,Incorporate them before the release,Incorporate them in the hardening Sprint,Incorporate them in the integration Sprint,,,1,"Non-functional features are usually part of the Definition of Done and should be considered for every Product Backlog item and every Increment. Sometime, some non-functional features that address a very particular part of the software can be added as separate items in the Product Backlog.

All Sprints are the same. There's no Sprint zero, hardening Sprint, release Sprint, integration Sprint, etc.",Scrum Artifacts
Which of the following is a prerequisite for starting the Sprint Planning meeting?,multiple-choice,Having the Product Backlog items cleared and assigned to developers,Having the items at the top of the Product Backlog small enough to fit in one Sprint,Having the requirements specified and completely reflected in the Product Backlog,None,,,4,"We prefer to have ""ready"" items at the top of the Product Backlog before Sprint Planning, which is done through Product Backlog refinement. However, nothing stops our flow of Sprints. For example, we do not delay the Sprint because the items are not ready. In such cases, the ""unready"" items would be selected for the Sprint and refined during the Sprint.

""Ready"" items are those that are clear and small enough to fit into one Sprint.",Scrum Events
Which of the following refers to the average amount of work done per Sprint?,multiple-choice,Capacity,Velocity,Burn-down rate,Performance,,,2,"Velocity is the amount of work (usually in ""story points"") done per Sprint. For example, 200 story points per Sprint.",Scrum Events
Who owns the Sprint Backlog?,multiple-choice,The Product Owner,The Development Team,The Scrum Master,The Scrum Team,,,2,The Development Team owns the Sprint Backlog and the Product Owner owns the Product Backlog.,Scrum Artifacts
A company has three products. Which two of the following are acceptable way of forming Scrum teams?,multi-select,There can be one Product Owner for each product,There should be one Product Owner for each product,There can be a single Product Owner for all products,There should be a single Product Owner for all products,,,"1,3","When there's one product, there should be only one Product Owner, even if the product is large and there are many Development Teams. However, when there are multiple products, there are two options:
a) considering them separate and have a Product Owner for each of them
b) have only one Product Owner for all of them and develop them like a larger project to ensure compatibility.",The Scrum Team
"When forming multiple Scrum teams, which two of the following are the most important considerations?",multi-select,Having proper size in each team,Having an effective mixture of skill in each team to avoid dependencies,Having a mixture of senior and junior developers in each team,Having enough skills for the technical layer designated to the each team,,,"1,2",All teams should be cross-functional with 3 to 9 members.,The Scrum Team
"If it's not possible to complete the Sprint Backlog, who would try to resolve it?",multiple-choice,The Development Team,The Scrum Master,The Development Team and the Product Owner,The Product Owner,The Scrum Team,,3,"First of all, it's OK of the Sprint Backlog is not complete until the end of the Sprint. However, we would try to complete it if it's possible. When the developers find out they are behind schedule they will ask the Product Owner for help and the two roles together will adjust the work (tasks), or reorder the times to make sure the highest value will be created at the end of the Sprint.",Scrum Artifacts
"When multiple teams are working on the same product, their Sprints should be synchronized, and their outputs should be integrated into one integrated Increment.",multiple-choice,TRUE,FALSE,,,,,1,"The output created by each team should be potentially releasable and then they will be packaged into one integrated Increment.

This means that each Product Backlog item would be handled by one team and each team should be cross-functional.

Teams should synchronize their Sprints in a way that reduces complexity. This could require them to start and finish their Sprints inthe same time.",Scrum Events
"Teams A and B work on two different projects. Team A has 8 members, and a velocity of 600. Team B has 6 members, and a velocity of 500. Which team has a higher performance?",multiple-choice,Team B,Team A,It depends,,,,3,The provided information is not enough. Velocity is defined locally and it's not possible to compare one team's velocity with the other.,Scrum Theory
Which of the following does NOT apply to/suit Scrum?,multiple-choice,Static requirements,Based on empirical process control,Difficult to master,Process framework used to address complex products,,,1,"Agile is all about depending on adaptation, instead of predictive (static, upfront) plan and design.",Scrum Theory
The Product Owner is using burn-up charts instead of burn-down charts. What would be your response as the Scrum Master?,multiple-choice,There's nothing wrong with it.,"Burn-up charts are used in traditional methods, and should be replaced by burn-down charts.",,,,,1,"Burn-down charts are very common for tracking and representing progress, but they are not mandatory and the Product Owner can use other tools/techniques as well.",The Scrum Team
Scrum is an iterative and incremental Agile framework.,multiple-choice,TRUE,FALSE,,,,,1,"Scrum is iterative because processes are repeated in each Sprint. It's incremental because it delivers the product in multiple incremental steps instead of in a big bang.

And of course it's Agile (adaptive instead of predictive).",Scrum Theory
Which element helps limit work-in-progress?,multiple-choice,Using timeboxes,Using Sprint Review,Using Product Backlogs,Using Sprint Retrospective,,,1,"When working inside timeboxes, it's better to limit work-in-progress and get items done before going to the next ones; otherwise chances would be high that the team ends up with many in-progress items and not enough ""Done"" items at the end of the Sprint.

Limiting work-in-progress is a lean concept that avoids waste.",Scrum Events
Who's in the Scrum Team? (Choose multiple answers),multi-select,Scrum Master,Development Team,Project manager,Product Owner,Team leader(s),,"1,2,4",Not all questions will this easy but you should still read them very carefully as they can easily be misinterpreted.,The Scrum Team
Which of the following is not a pillar of Scrum?,multiple-choice,Transparency,Inspection,Empiricism,Adaptation,,,3,"The three pillars of Scrum are adaptation, inspection and transparency. Scrum is based on empiricism but it's not one of the pillars.",Scrum Theory
"Which statement is least accurate about the definition of ""Done""?",multiple-choice,It may evolve during the project,It's created by the Product Owner,It may vary depending on the project,It may be defined by the development organization,,,2,"The definition of ""Done"" can be prepared in the development organization and used in all projects as a minimum. If additional content is required for the definition or it's not prepared in the organization level, the Development Team would be responsible for preparing it.

The definition of ""Done"" can evolve during the project as more is learned. It's also dependent on the project and its environment.",Artifact Transparency
The Product Backlog is reordered by the stakeholders at the Sprint Review meeting.,multiple-choice,TRUE,FALSE,,,,,2,Only the Product Owner can order the Product Backlog. This can be influenced by other stakeholders but the Product Owner always has the final say.,Scrum Artifacts
"When multiple teams are working on the same product, who should make sure that their outputs can be integrated into one Increment?",multiple-choice,The developers,The developers and the Product Owner,The Product Owner,The Scrum Master,,,1,It's up to the developers to find their way and ensure that their outputs will create an integrated Increment that is potentially releasable.,The Scrum Team
Which statements are correct about Sprint Retrospective meeting? (Choose 2 answers),multi-select,It happens before the Sprint Review,It's an opportunity for inspection and adaptation,It's three hours in a one-month Sprint,It's the only time improvement are planned for the project,The Product Owner doesn't have to be at the meeting,,"2,3","The Sprint Retrospective happens after the Sprint Review; it's the last event in the Sprint. It's three hours in a one-month Sprint and all Scrum Team members attend it.

Its purpose is planning for improvements in the process (the way we're working), but it's not the only time we try to improve.

Similar to Sprint Planning, Sprint Review and Daily Scrum, it's an opportunity for inspection and adaptation.",Scrum Events
The Product Backlog refinement shouldn't take more than 10% of the Product Owner's time.,multiple-choice,TRUE,FALSE,,,,,2,The Product Backlog refinement is done by the Product Owner and the Development Team. The rule is that it shouldn't take more than 10% of the developers' time. The Product Owner spends as much time as required on refinement.,Scrum Events
Which of the following is a way of decreasing technical debt?,multiple-choice,Hiring an external auditor,"Improving the definition of ""Done""",Having hardening Sprints,,,,2,"There's usually room for improving the definition of ""Done"". A good definition will let less technical debt pass on to the next Sprints.

Technical debt is minor shortcomings in the code that makes it less than ""good enough"" and therefore creates risks in the future. It usually decreases velocity in the future (because the team has to fix the shortcomings) and as some of the debt might remain in the final product, the maintenance cost will increase as well.

Another Agile way of reducing technical debt is continuous refactoring.",Artifact Transparency
Which of the following is the shortest timebox in a two-week Sprint?,multiple-choice,Sprint Retrospective,Sprint Planning,Sprint Review,,,,1,"These are the durations in a two-week Sprint:
- Sprint Planning: 4 hours
- Sprint Review: 2 hours
- Sprint Retrospective: 1.5 hours",Scrum Events
What's the optimal length of a Sprint?,multiple-choice,Short enough to minimize risk,One week,Two weeks,One month,,,1,We prefer shorter Sprints as long as we can produce enough output. Shorter Sprints reduce the risk to the business.,Scrum Events
"The Product Owner is responsible for the definition of ""Done"".",multiple-choice,TRUE,FALSE,,,,,2,"If there's a definition of ""Done"" in the development organization that would be used for all projects. Otherwise, the Development Team would be responsible for creating one.

Even when there's a definition of ""Done"" in the organization, it can be used as a minimum and the developer can add extra elements to it (eg to decrease technical debt).",Artifact Transparency
Which statement is right during the Sprint?,multiple-choice,"Some Sprint Backlog items would be replaced with items from the Product Backlog, if the priorities change",The scope may be re-negotiated as more is learned,Some Sprint Backlog items would be moved back to the Product Backlog to be completed in future Sprints,,,,2,"During the Sprint, the Product Backlog items in the Sprint Backlog would not be added or removed but as more is learned, the scope may be clarified and re-negotiated between the Product Owner and Development Team. This is mainly focused on the interpretation of the Product Backlog items and the tasks created by decomposing them.",Scrum Artifacts
"What should happen to the ""Done"" Product Backlog items when the Sprint is cancelled?",multiple-choice,"They should be moved back to the Product Backlog, and would be taken care of in the future Sprints",They should be moved to the next Sprint Backlog.,"They will be reviewed, and if they are potentially releasable, the Product Owner typically accepts them.",,,,3,"The Development Team is responsible for the definition of ""Done"" rather than the Product Owner. So, if the Product Owner doubts the quality of the definition of ""Done"", he/she can discuss it with the team on the next Sprint Retrospective, so that if they agree, it would be adjusted for the next Sprint.",Scrum Events
The Product Owner is responsible for preparing the Sprint Goal before the Sprint Planning.,multiple-choice,TRUE,FALSE,,,,,2,The Sprint Goal is prepared during the Sprint Planning by the whole Scrum Team.,Scrum Events
The Scrum Master is a participant in Sprint Retrospective.,multiple-choice,TRUE,FALSE,,,,,1,All team members participate and try to find ways for improvement.,Scrum Events
All interactions between the stakeholders and the Development Team should be through the Product Owner.,multiple-choice,TRUE,FALSE,,,,,2,The interactions can be through the Product Owner or during the Sprint Review. Other interactions are discouraged as they distract the developers.,Scrum Events
Which of the following is not allowed in Scrum?,multiple-choice,Refactoring,Hardening Sprints,Velocity tracking,Release planning,,,2,Hardening Sprints are not allowed because the subject of hardening should be continuously address throughout normal Sprints. All Sprints are the same in Scrum. Other options are not described in the framework but are good practices recommended for Scrum projects.,Scrum Events
The Sprint Backlog is baselined at the end of the Sprint Planning.,multiple-choice,TRUE,FALSE,,,,,2,We don't baseline any artifact in Scrum. The Sprint Backlog is dynamic and changes during the Sprint to include newly identified tasks.,Scrum Artifacts
All work that the developers should do originate from the Product Backlog,multiple-choice,TRUE,FALSE,,,,,1,Everything they do is identified by decomposing the Product Backlog items.,Scrum Artifacts
It is OK for the items at the bottom of the Product Backlog not to be as clear as those at the top.,multiple-choice,TRUE,FALSE,,,,,1,"Items at the bottom of the Product Backlog won't be developed soon, so, there's no need to spend too much time making them clear and add details; that would be some kind of upfront planning. Not that the items do not go to the bottom of the backlog because they are not clear or do not have enough detail; the only basis for order of items is the business value. When the item does not have enough detail and starts to go to the top of the Product Backlog, it should be refined by adding more detail.",Scrum Artifacts
Ordering the Product Backlog items is part of the Product Backlog refinement.,multiple-choice,TRUE,FALSE,,,,,1,"Product Backlog refinement is defined in the Scrum Guide as the act of adding detail, estimates and order to the Product Backlog items. Remember that the Product Backlog refinement is an ongoing activity and is not timeboxed. The rule is that it shouldn't take more than 10% of the developers' time.",Scrum Artifacts
The Product Owner can ask the developers to order the Product Backlog items instead of him/her.,multiple-choice,TRUE,FALSE,,,,,1,The Product Owner can delegate his/her responsibilities to the development team but he/she stays accountable.,The Scrum Team
The Product Owner can delegate some of his/her responsibilities to the Development Team.,multiple-choice,TRUE,FALSE,,,,,1,The Product Owner can delegate his/her responsibilities to the development team but he/she stays accountable.,The Scrum Team
Scrum should be tailored for the project.,multiple-choice,TRUE,FALSE,,,,,2,"Unlike methodologies, the Scrum ""framework"" is not tailored because it's already limited to the essentials. Even the terms should not change let along adding or removing elements such as roles and events. However, you need to add many practices and techniques to the framework.",Scrum Theory
"Our velocity was 250 at the end of the 6th Sprint. It has become 275 at the end of the 11th Sprint. Therefore, we're creating more value now, compared to the past.",multiple-choice,TRUE,FALSE,,,,,2,"Velocity and value are not related directly. Value is the benefit to cost ratio. Since we start with the most important items first, those remained for the 11th Sprint are expected to have less value compared to those delivered at the 6th Sprint.",Scrum Theory
"Which of the following roles can set the definition of ""Done""?",multiple-choice,The Scrum Team,The Scrum Master,The Development Team,The Product Owner,,,3,"The development organization may have a definition of ""Done"" composed for all projects in which case the team will use it as a minimum. Otherwise, the Development Team would be responsible for composing the definition of ""Done"". When multiple teams are working on the same product, there can be more than one definition of ""Done"", as long as they all have the minimums required by the development organization and can create an integrated Increment.",Artifact Transparency
When should the Product Backlog items be refined? (choose 2 answers),multi-select,Before the Sprint in which the item is supposed to be developed,The business analysts do it before it is time to develop the item,"During the Sprint, if they have not been refined in the previous Sprints",,,,"1,3","Product Backlog refinement is a continuous activity. When an item is at the top of the backlog, which means it will be developed in the near future, more refinements are usually needed to make sure it is clear and contains just enough details (not all possible details). It's preferred to have the items that will be selected in the Sprint Backlog completely refined before Sprint Planning; however, it's OK to have more refinement done during the development. Remember that there's no such thing as Sprint 0 and there's no time between two Sprints that can be spent on something such as refinement. The team is also cross-functional and does the a-z of the work needed for each item, including refinement; they don't use people from other parts of the company.",Scrum Artifacts
