"What does it mean to say a Product Backlog item is ""Done""? (Choose 3 answers)",multi-select,The item is ready for functional testing by the Product Owner,The item creates a software that is usable by the end user,No work left based on the Definition of Done,The item can be a part of a potentially releasable piece of software,All tasks identified for the item are done,The item is ready for user acceptance testing,"2,3,4","Items are ""Done"" when they are complete based on the definition of ""Done"". In that case, they would have the potential of creating a releasable/shippable Increment that is usable by the end user. Tests are also part of the work and items are not ""Done"" before the tests are complete; even the user acceptance tests. Quality requirements are part of the work but not all of it (eg non-functional features and development processes are also part of the work). We cannot trust the identified tasks because we might have missed some tasks and the sum of them do not conform to the definition of ""Done"".",Artifact Transparency
Which of the following is designed to synchronize multiple teams working on the same product?,multiple-choice,Daily Scrum,Sprint Planning,Weekly status report,Scrum-of-scrums,,,4,"Daily Scrum is for synchronizing inside a team and Scrum-of-Scrums is for synchronizing multiple teams working on the same product. When the Daily Scrum is over, one representative from each team goes to a higher level daily stand-up to discuss the issues among teams. Note: scrum.org has recently introduced its scaled Scrum framework called Nexus. It doesn't have a scrum-of-scrum as described here, while there might still be some questions about it in the exam.",Scrum Events
"Only the Product Owner has the authority to cancel a Sprint. However, the Development Team is trying to convince the Product Owner that the Sprint should be cancelled. What's the right response from the Scrum Master?",multiple-choice,It is OK,"The Scrum Master should stop this, because the Development Team does not have the authority to influence Sprint cancellation",The Scrum Master should encourage the Product Owner to discuss it with the customer first,The Scrum Master should be involved in making this decision,,,1,"Only the Product Owner can cancel a Sprint and the final decision belongs to him/her. However, this decision can be influenced by the customer, developers and Scrum Master.",Scrum Events
Each new Sprint starts immediately after the previous Sprint.,multiple-choice,TRUE,FALSE,,,,,1,Nothing happens between two Sprints; the next one starts immediately after the conclusion of the previous.,Artifact Transparency
Which statement is correct when the developers are working in the middle of the Sprint?,multiple-choice,The Sprint Backlog would be frozen,No user acceptance tests will be conducted until the end of the Sprint,The scope may be clarified as more is learned,,,,3,"During the Sprint, the Product Backlog items in the Sprint Backlog would not be added or removed but as more is learned, the scope may be clarified and re-negotiated between the Product Owner and Development Team. This is mainly focused on the interpretation of the Product Backlog items and the tasks created by decomposing them.",The Scrum Team
The Sprint Review is the only time when stakeholder feedback is captured.,multiple-choice,TRUE,FALSE,,,,,2,The Sprint Review is probably the most important opportunity for capturing feedback but adaptation is not limited to that. The Product Owner is constantly in contact with the stakeholders to identify new Product Backlog items or to refine them.,Scrum Events
Who updates work remaining during the Sprint?,multiple-choice,The Development Team,The Scrum Team,The Scrum Master,The Product Owner,,,1,he Product Owner is responsible for measuring the progress of the project and tracking the remaining work in the Product Backlog. The Development Team is responsible for measuring the progress of the Sprint and tracking the remaining work in the Sprint Backlog.,Scrum Artifacts
Conflict should be avoided at all cost on Agile teams.,multiple-choice,TRUE,FALSE,,,,,2,Managed conflicts can be helpful to the project.,Scrum Theory
Which of the following is the most important opportunity for capturing lessons learned?,multiple-choice,Sprint Retrospective,Sprint Planning,Sprint Review,Daily Scrum,,,1,Lessons learned are always captured but the main purpose of Sprint Retrospective is capturing and planning for lessons learned.,Scrum Events
"When multiple Scrum teams are working on the same product, should all of their outputs be integrated every Sprint?",multiple-choice,Yes,No,"Yes, only if there are dependencies among them",,,,1,All teams start and finish the Sprint within their defined timeboxes and their outputs would be combined and create an integrated Increment.,Scrum Artifacts
Which of the following best describes transparency?,multiple-choice,The whole process should be visible to everyone.,"The process should be visible, and understood by key stakeholders.",The whole process should be visible to stakeholders.,Significant aspects of the process must be visible to those responsible for the outcome.,,,4,"Transparency is about visibility and doesn't contain understanding; even though we'd better try our best to create the right understanding too but that's another story. The ""whole process"" might  be too much for some stakeholders; ""significant aspects"" is enough, as we treat most things in Agile environments.",Artifact Transparency
It's up to the Development Team to decide which Scrum events are needed during the Sprint.,multiple-choice,TRUE,FALSE,,,,,2,All Scrum events are necessary; they should never be removed.,Scrum Events
The purpose of the Daily Scrum is for the developers to inform the Product Owner of the progress.,multiple-choice,TRUE,FALSE,,,,,2,The main purpose of Daily Scrum is synchronization of the developers.,Scrum Events
The Product Owner doesn't spend enough time on the project. Which of the following options is the best response from the Scrum Master?,multiple-choice,Nominate a proxy Product Owner,Train the Product Owner why it's important for her/him to spend enough time on the project,Bring up the issue in the Sprint Retrospective,Send the Product Owner to a proper training,Inform the Product Owner's functional manager,,2,The Scrum Master is responsible to train and coach team members on a proactive way and convince them to do the right thing. All other options are either reactive or not self-organized.,The Scrum Team
The Product Owner and Scrum Master should not be part of the Development Team.,multiple-choice,TRUE,FALSE,,,,,2,"It's OK for one person to have more than one of the three Scrum roles even though it's not recommended. eg Product Owner and developer. Note: when we say that a sentence like this is false, it means that the opposite is right. However, remember that the opposite of ""should not"" is ""may"" rather than ""should"".",The Scrum Team
It's allowed to have team leaders when there are many developers working on a complex project.,multiple-choice,TRUE,FALSE,,,,,2,"No extra roles and titles are recognized in Scrum because it blocks self-organization, collaboration and accountability.",The Scrum Team
Which statement is correct when multiple Scrum teams are working on the same product?,multiple-choice,"There can be multiple Product Backlogs, when it's possible to divide the product into different application areas",There's only one Product Backlog for all of them,"There can be multiple Product Backlogs, but still a single integrated Product Backlog to summarize them all.",,,,2,"""One"" project and ""one"" product has only ""one"" Product Backlog and ""one"" Product Owner. Otherwise, prioritization and accountability would be difficult.",Scrum Theory
The Development Team cannot deliver the Increment because they don't understand a functional requirement. What should they do?,multiple-choice,Partially complete the work,Move the work to a future Sprint,Ask a specialist to solve the problem within the remaining duration of the Sprint,Collaborate with the Product Owner to solve the problem,,,4,"The Product Owner is responsible to make all items clear and understood. If the problem wasn't solved, then there's no option other than leaving it to go back to the Product Backlog at the end of the Sprint and be done later. The team is cross-functional and doesn't use external help. We don't deliver partially complete items; everything should be done based on the definition of ""Done"".",The Scrum Team
Who creates the Sprint Goal?,multiple-choice,The Scrum Master,The Product Owner,The Scrum Team,The Development Team,,,3,All Scrum Team members together compose the Sprint Goal during the Sprint Planning.,Scrum Events
How can we ensure that the performance requirements are addressed in the solution? (Choose 2 answers),multi-select,"Add them to the definition of ""Done""",Add them as items to the Product Backlog,Add a performance tester to the team,Use hardening Sprints to improve performance,,,"1,2","Performance, like security, scalability and maintainability is a non-functional feature. Non-functional features are normally added to the definition of ""Done"" because they apply to all functional features. For some non-functional features, such as performance, it's possible to create non-technical, independent items in the Product Backlog. This is usually done when we have to make an improvement in the previously done features.",Scrum Artifacts
"When multiple teams are working on the same product, each team should have their own definition of ""Done"".",multiple-choice,TRUE,FALSE,,,,,2,"All teams can use the same definition of ""Done"" but if required they can have different definitions as long as they are compatible and capable of creating integrated Increments. The answer to this question would have been ""true"" instead of ""false"" if there was a ""may"" instead of ""should"".",Artifact Transparency
How complete should the Sprint Backlog be at the end of the Sprint Planning meeting?,multiple-choice,Complete enough to show the work for the next few days.,It depends on the preference of the Product Owner.,The Sprint Backlog should be complete at the end of the Sprint Planning.,,,,1,Not all tasks are identified in the Sprint Planning; just enough to show what the development team is going to do in the next few days. The rest of the tasks will be created during the Sprint.,Scrum Events
What happens when the Product Backlog is not clear enough at Sprint Planning?,multiple-choice,Nothing; the Sprint would be planned anyway.,"The Sprint would be cancelled, and the next one will start as soon as enough items at the top of the Product Backlog are clear.","The Sprint Planning would be delayed, until enough refinement is done on the items at the top of the Product Backlog.","The Sprint Planning would be extended, to have the items refined before adding them to the Sprint Backlog.",,,1,"We prefer to have ""ready"" items at the top of the Product Backlog before Sprint Planning, which is done through Product Backlog refinement. However, nothing stops our flow of Sprints, for example, we do not delay the Sprint because the items are not ready. In such cases, the ""unready"" items would be selected for the Sprint anyway and refined during the Sprint. ""Ready"" items are those that are clear and small enough to fit into one Sprint.",Scrum Events
It's required to use user stories in Scrum.,multiple-choice,TRUE,FALSE,,,,,2,It's a good idea to use user stories for describing the Product Backlog items but it's not required.,Scrum Artifacts